{
  "version": 0,
  "architecture": "x86_64",
  "toolchain": "1.96.0",
  "target": "x86_64-unknown-none",
  "request_entry": "kozo_rust_user_request_entry",
  "response_entry": "kozo_rust_user_response_entry",
  "request_adapter": "user_privilege_probe_start",
  "response_adapter": "user_response_consumer_start",
  "code_virtual_address": "0x0000400000000000",
  "code_size_bytes": 4096,
  "data_size_bytes": 4096,
  "stack_size_bytes": 4096,
  "initial_rsp": "0x0000400000002ff0",
  "pre_call_rsp_modulo_16": 0,
  "rust_entry_rsp_modulo_16": 8,
  "stack_budget_bytes": 256,
  "red_zone": false,
  "panic": "abort",
  "allocator": false,
  "sessions": 2,
  "transitions_per_session": 2,
  "marker_occurrences": 52,
  "wire_contract": "contracts/fixed_user_request_boundary_contract.v1.json",
  "required_evidence": [
    "independent_pinned_object",
    "read_only_closed_relocations",
    "linked_entry_bytes_match_object",
    "rust_entries_in_user_rx_page",
    "exact_hardware_frame",
    "rust_request_and_response_validation",
    "two_completed_sessions",
    "hosted_qemu_controls"
  ],
  "non_goals": [
    "processes",
    "scheduler",
    "loader",
    "dynamic allocation",
    "new mappings",
    "new interrupt vectors",
    "public syscall ABI",
    "Windows runtime",
    "macOS runtime"
  ]
}
